slug,name,category,tier,description,date_added,last_tested
tsp-to-tbsp,Teaspoons to Tablespoons Converter,converters,3,Convert teaspoons to tablespoons quickly. Free online tsp to tbsp calculator for cooking and baking recipes.,2026-03-12,2026-03-12
lbs-to-oz,Pounds to Ounces Converter,converters,3,Convert pounds to ounces instantly. Free online lbs to oz calculator with common weight conversions and formula.,2026-03-12,2026-03-12
oz-to-lbs,Ounces to Pounds Converter,converters,3,Convert ounces to pounds quickly. Free online oz to lbs calculator with common weight conversions and formula.,2026-03-12,2026-03-12
mortgage-overpayment-calculator,Mortgage Overpayment Calculator,finance,2,"See how much you could save by overpaying your mortgage. Calculate time saved, interest saved, and compare your new payoff date with your original term.",2026-03-12,2026-03-12
debt-snowball-calculator,Debt Snowball Calculator,finance,2,"Compare Snowball and Avalanche debt payoff strategies. Add your debts, set an extra payment amount, and see which method gets you debt-free fastest.",2026-03-12,2026-03-12
colour-contrast-checker-pro,Colour Contrast Checker,creative,2,Check your text and background colour combinations against WCAG AA and AAA accessibility standards. Get contrast ratios and fix suggestions instantly.,2026-03-12,2026-03-12
energy-cost-calculator,Energy Cost Calculator,home,2,"Calculate the running cost of your household appliances. See costs per hour, day, week, month, and year based on current UK electricity rates.",2026-03-12,2026-03-12
split-bill-calculator,Split Bill Calculator,finance,2,Split a restaurant bill between friends with tip calculation. Choose equal split or itemised mode to assign dishes to individuals.,2026-03-12,2026-03-12
savings-goal-calculator,Savings Goal Calculator,finance,2,"Work out how much to save per week, fortnight, or month to hit your savings target. See a month-by-month breakdown with optional interest.",2026-03-12,2026-03-12
salary-breakdown-visualiser,Salary Breakdown Visualiser,finance,2,"See exactly where your UK salary goes. Visual breakdown of income tax, National Insurance, pension, student loan, and your monthly expenses.",2026-03-12,2026-03-12
rent-vs-buy-calculator,Rent vs Buy Calculator,finance,2,"Compare the total cost of renting versus buying a home in the UK over 5 to 25 years. Includes stamp duty, maintenance, equity, and mortgage costs.",2026-03-12,2026-03-12
pixel-to-rem-converter,Pixel to REM Converter,developer,2,"Convert pixels to REM units and back. Set your base font size, see a reference table of common values, and copy CSS with one click.",2026-03-12,2026-03-12
box-shadow-generator,CSS Box Shadow Generator,developer,2,"Build CSS box shadows visually with live preview. Adjust offset, blur, spread, colour, and opacity. Stack multiple layers and copy the CSS.",2026-03-12,2026-03-12
gradient-generator,CSS Gradient Generator,developer,2,"Create beautiful CSS gradients with a visual builder. Choose colours, positions, angles, and gradient type. Copy the CSS with vendor prefixes.",2026-03-12,2026-03-12
electricity-bill-estimator,Electricity Bill Estimator,home,2,"Estimate your UK electricity bill from meter readings or kWh usage. Supports standard, fixed rate, and Economy 7 tariffs with current rates.",2026-03-12,2026-03-12
screen-size-calculator,Screen Size Calculator,maths,2,"Calculate the actual width and height of a screen from its diagonal size and aspect ratio. Useful when buying monitors, TVs, or tablets.",2026-03-12,2026-03-12
wedding-guest-list-manager,Wedding Guest List Manager,wedding,1,"Manage your wedding guest list with RSVP tracking, dietary requirements, table assignments, and plus-ones. Filter and sort your full guest list.",2026-03-12,2026-03-12
signature-pad,Signature Pad,creative,2,Draw your signature digitally and download it as a transparent PNG. Choose pen colour and thickness for a natural-looking result.,2026-03-12,2026-03-12
pixel-art-maker,Pixel Art Maker,creative,2,"Create pixel art with a grid-based editor. Choose grid size, colours, and tools like pen, eraser, and fill. Download your creation as PNG.",2026-03-12,2026-03-12
meme-generator,Meme Generator,creative,2,Create memes with custom text on uploaded images or colour backgrounds. Classic top and bottom text with Impact-style font and black outline.,2026-03-12,2026-03-12
photo-filter-tool,Photo Filter Tool,creative,2,"Apply filters to your photos right in the browser. Adjust brightness, contrast, saturation, blur, and more. Quick presets and before/after comparison.",2026-03-12,2026-03-12
whiteboard,Whiteboard,creative,2,"A freehand drawing board with pen, highlighter, eraser, and shape tools. Choose colours and brush sizes, then download your drawing as PNG.",2026-03-12,2026-03-12
easter-egg-hunt-clue-generator,Easter Egg Hunt Clue Generator,parenting,1,"Generate rhyming clue cards for Easter egg hunts. Choose age group, location and theme to get printable clues with a parent cheat sheet of hiding spots.",2026-03-12,2026-03-12
christmas-treasure-hunt-generator,Christmas Treasure Hunt Generator,parenting,1,Create a magical Christmas morning treasure hunt leading to presents. Personalise with your child's name and choose age-appropriate clues for common household locations.,2026-03-12,2026-03-12
birthday-party-game-planner,Birthday Party Game Planner,parenting,1,"Plan the perfect kids' birthday party with a timed game schedule. Pick age group, theme and duration to get game rules, a materials checklist and printable scorecards.",2026-03-12,2026-03-12
treasure-hunt-clue-generator,Treasure Hunt Clue Generator,parenting,1,"Generate themed treasure hunt clues for any occasion. Choose from pirates, space, nature or detective themes with age-appropriate riddles for indoor or outdoor hunts.",2026-03-12,2026-03-12
pass-the-parcel-forfeit-generator,Pass the Parcel Forfeit Generator,parenting,2,"Generate fun, age-appropriate forfeits and challenges for each layer of pass the parcel. Perfect for birthday parties with kids of all ages.",2026-03-12,2026-03-12
kids-activity-spinner,Kids Activity Spinner,parenting,2,"Spin the wheel for a random kids' activity with full instructions. Filter by age group, indoor or outdoor, and available time for instant activity ideas.",2026-03-12,2026-03-12
scavenger-hunt-generator,Scavenger Hunt Generator,parenting,2,"Create printable scavenger hunt checklists for nature walks, indoor play or park adventures. Season-aware with age-appropriate items and pictures for younger kids.",2026-03-12,2026-03-12
rainy-day-schedule-generator,Rainy Day Schedule Generator,parenting,2,"Fill a rainy day with balanced activities for kids. Get a timed schedule mixing crafts, games, baking, screen time and reading, tailored to your child's age.",2026-03-12,2026-03-12
science-experiment-generator,Science Experiment Generator,parenting,2,"Discover fun, safe science experiments for kids using household items. Filter by age, mess level and materials to get step-by-step instructions with explanations.",2026-03-12,2026-03-12
craft-project-generator,Craft Project Generator,parenting,2,"Get instant craft project ideas with step-by-step instructions for kids. Filter by age, available materials and difficulty for the perfect creative activity.",2026-03-12,2026-03-12
elf-on-the-shelf-idea-generator,Elf on the Shelf Idea Generator,parenting,2,Get 25 days of creative Elf on the Shelf scenarios with setup instructions and supply lists. Filter by difficulty and location for stress-free holiday magic.,2026-03-12,2026-03-12
advent-calendar-activity-generator,Advent Calendar Activity Generator,parenting,2,"Generate 24 unique daily activities for December 1 to 24. Mix of crafts, baking, games, kindness tasks and adventures, tailored to your child's age and budget.",2026-03-12,2026-03-12
halloween-scavenger-hunt,Halloween Scavenger Hunt,parenting,2,Create a spooky scavenger hunt for Halloween with age-appropriate items. Choose scare level from friendly to full Halloween for indoor or garden hunts.,2026-03-12,2026-03-12
phonics-treasure-hunt,Phonics Treasure Hunt,parenting,2,Create an educational treasure hunt where kids find letter cards and build words. Choose target sounds and age group for a fun phonics activity at home.,2026-03-12,2026-03-12
party-bag-checklist-generator,Party Bag Checklist Generator,parenting,2,"Plan party bags on any budget. Pick age group, theme and budget per bag to get a complete shopping list with item quantities and estimated total cost.",2026-03-12,2026-03-12
which-decade-do-you-belong-in,Which Decade Do You Belong In?,quiz,2,"Take our fun personality quiz to discover which decade suits you best. Answer 12 lifestyle questions to find out if you are a 50s soul, an 80s kid or a 00s native.",2026-03-12,2026-03-12
what-type-of-friend-are-you,What Type of Friend Are You?,quiz,2,"Find out your friendship style with this personality quiz. Are you the Mum Friend, the Chaos Friend, the Planner, the Therapist or the Hype Person?",2026-03-12,2026-03-12
what-dog-breed-are-you,What Dog Breed Are You?,quiz,2,"Discover which dog breed matches your personality. Answer 12 questions about your lifestyle, energy level and social preferences to find your canine counterpart.",2026-03-12,2026-03-12
what-career-suits-you,What Career Suits You?,quiz,2,Explore career paths that match your personality and strengths. Answer 15 questions inspired by Holland codes to discover your ideal career cluster.,2026-03-12,2026-03-12
how-british-are-you,How British Are You?,quiz,2,Test your British knowledge and mannerisms with 15 cultural questions. Get a percentage score from Basically American to More British Than The Queen.,2026-03-12,2026-03-12
hogwarts-house-quiz,Fantasy House Sorting Quiz,quiz,2,"Discover which fantasy house you belong to: The Scholars, The Brave, The Ambitious or The Loyal. Answer 12 personality questions to find your true house.",2026-03-12,2026-03-12
introvert-extrovert-scale,Introvert or Extrovert Scale,quiz,2,Find where you sit on the introvert to extrovert spectrum. Answer 15 questions for a percentage score with personalised tips for your personality type.,2026-03-12,2026-03-12
stress-level-assessment,Stress Level Assessment,quiz,2,Measure your perceived stress with the validated PSS-10 questionnaire. Get a score with personalised stress management tips. For educational purposes only.,2026-03-12,2026-03-12
what-element-are-you,What Element Are You?,quiz,2,"Discover if you are Fire, Water, Earth or Air. Answer 10 personality questions to find your element with traits, strengths, weaknesses and compatibility.",2026-03-12,2026-03-12
mental-age-quiz,Mental Age Quiz,quiz,2,"Find your mental age with 15 fun questions about habits, preferences and reactions. A light-hearted quiz for entertainment only. Share your result with friends!",2026-03-12,2026-03-12
pub-quiz-generator,Pub Quiz Generator,games,1,"Generate a complete pub quiz with rounds, questions and answers. Choose from 10 categories and 3 difficulty levels with 1,000+ questions in the database.",2026-03-12,2026-03-12
scattergories-list-generator,Scattergories List Generator,games,2,Generate random Scattergories rounds with a letter and 12 categories. Includes a built-in timer and 100+ category options for endless game nights.,2026-03-12,2026-03-12
music-round-generator,Music Round Generator,games,2,Create a music round for your quiz night. Filter by decade and genre from a database of 150+ songs. Generate song or artist questions with answer key.,2026-03-12,2026-03-12
secret-santa-generator,Secret Santa Generator,games,1,"Generate Secret Santa pairings for your group. Add participants, set exclusions and budget, then reveal assignments one at a time so nobody sees anyone else's match.",2026-03-12,2026-03-12
who-knows-me-best,Who Knows Me Best?,games,2,"Create a personal quiz about yourself for friends to answer. Enter your questions and answers, then share and see who knows you best with automatic scoring.",2026-03-12,2026-03-12
couples-quiz-generator,Couples Quiz Generator,games,2,"Generate a Mr and Mrs style couples quiz. Choose sweet, funny or spicy questions for date nights, hen dos or anniversaries. 100+ questions in the database.",2026-03-12,2026-03-12
pub-quiz-answer-sheet-printer,Pub Quiz Answer Sheet Printer,games,2,"Print clean answer sheets for your quiz night. Set team name, rounds and questions per round for a professional answer grid with scoring section.",2026-03-12,2026-03-12
wedding-timeline-builder,Wedding Timeline Builder,wedding,2,Generate a complete wedding day timeline from ceremony to last dance. Set your ceremony time and preferences to get a minute-by-minute schedule with buffer times.,2026-03-12,2026-03-12
wedding-table-name-generator,Wedding Table Name Generator,wedding,2,"Generate themed table names for your wedding reception. Choose from flowers, cities, films, books, wines and more, each with a description or fun fact.",2026-03-12,2026-03-12
hen-do-planner,Hen Do Planner,wedding,2,"Plan the perfect hen party with a full itinerary, budget split and packing list. Choose budget tier, location type and duration for a stress-free celebration.",2026-03-12,2026-03-12
wedding-speech-outline-generator,Wedding Speech Outline Generator,wedding,2,"Get a structured outline for your wedding speech. Choose your role, tone and add key stories for a speech framework covering opening, stories, tribute and toast.",2026-03-12,2026-03-12
wedding-invitation-wording-generator,Wedding Invitation Wording Generator,wedding,2,"Generate elegant invitation wording for your wedding. Choose formality level and ceremony type, then customise with your details for three wording options.",2026-03-12,2026-03-12
moving-house-checklist,Moving House Checklist,home,2,"Get a dated moving checklist counting down from 8 weeks to moving day. Track tasks like notifying utilities, arranging removals and redirecting post.",2026-03-12,2026-03-12
broadband-speed-converter,Broadband Speed Converter,home,2,"Convert broadband speeds between Mbps, MB/s and Gbps. See real-world download times for photos, songs, HD films and games at your connection speed.",2026-03-12,2026-03-12
cleaning-schedule-generator,Cleaning Schedule Generator,home,2,"Generate a weekly cleaning rota for your household. Assign 40+ cleaning tasks across rooms and people for a fair, organised schedule you can print.",2026-03-12,2026-03-12
tv-size-calculator,TV Size Calculator,home,2,Find the perfect TV size for your room. Enter your viewing distance to get a recommended screen size with an optimal viewing distance reference table.,2026-03-12,2026-03-12
habit-tracker,Habit Tracker,home,2,"Create a printable monthly habit tracker grid. Add up to 10 habits, pick your month and track daily completion with percentage stats for each habit.",2026-03-12,2026-03-12
tipping-guide-abroad,Tipping Guide Abroad,home,2,"Check tipping customs for 25+ countries. See expected percentages for restaurants, taxis, hotels and more with local etiquette notes for each destination.",2026-03-12,2026-03-12
home-inventory-tracker,Home Inventory Tracker,home,2,Track your home contents room by room for insurance. Add items with values and purchase years to get a complete inventory with total estimated value.,2026-03-12,2026-03-12
halloween-costume-idea-generator,Halloween Costume Idea Generator,seasonal,2,"Get Halloween costume ideas for any age and budget. Filter by age group, solo or group, and DIY level for creative costume suggestions with materials lists.",2026-03-12,2026-03-12
christmas-gift-budget-tracker,Christmas Gift Budget Tracker,seasonal,2,"Track your Christmas gift spending with a per-person budget. See allocated, spent and remaining amounts with traffic-light indicators and overall totals.",2026-03-12,2026-03-12
christmas-dinner-planner,Christmas Dinner Planner,seasonal,2,"Plan your Christmas dinner for 2 to 20 guests. Get a shopping list with quantities, a cooking timeline working backwards from serving time and dietary adaptations.",2026-03-12,2026-03-12
easter-activity-planner,Easter Activity Planner,seasonal,2,"Plan a full day of Easter fun for kids. Get a timed schedule of egg decorating, hunts, crafts and games tailored to age group, location and duration.",2026-03-12,2026-03-12
bonfire-night-planner,Bonfire Night Planner,seasonal,2,"Plan a safe and fun Bonfire Night with a safety checklist, food quantity calculator and sparkler safety guide. Perfect for hosting a garden fireworks party.",2026-03-12,2026-03-12
back-to-school-checklist,Back to School Checklist,seasonal,2,"Get a UK-specific back-to-school supplies checklist by year group. Covers uniform, stationery, PE kit, bags and lunch supplies for primary and secondary.",2026-03-12,2026-03-12
mothers-day-gift-idea-generator,Mother's Day Gift Idea Generator,seasonal,2,"Get personalised Mother's Day gift suggestions based on her interests, your budget and your relationship. Thoughtful ideas from handmade to luxury.",2026-03-12,2026-03-12
fathers-day-gift-idea-generator,Father's Day Gift Idea Generator,seasonal,2,"Get personalised Father's Day gift suggestions based on his interests, your budget and your relationship. Ideas from experiences to gadgets to handmade.",2026-03-12,2026-03-12
wizard-name-generator,Wizard Name Generator,fun,3,"Generate a fantasy wizard name with title, realm and magical specialty. Choose your personality type and style for a unique wizard identity.",2026-03-12,2026-03-12
elf-name-generator,Elf Name Generator,fun,3,"Discover your Christmas elf name, job title and personality. Enter your real name to generate a unique elf identity perfect for holiday fun.",2026-03-12,2026-03-12
celebrity-birthday-twin,Celebrity Birthday Twin,fun,2,Find out which celebrities share your birthday. Enter your birth date to discover famous people born on the same day with their birth year and claim to fame.,2026-03-12,2026-03-12
paint-colour-mixer,Paint Colour Mixer,fun,2,Mix two colours together to see the result. Pick colours from a palette or custom picker and see what you get with hex codes and colour name approximations.,2026-03-12,2026-03-12
uk-council-tax-calculator,UK Council Tax Calculator,finance,2,Estimate your council tax by band and region. Includes single person discount and shows annual and monthly amounts based on 2026/27 rates for UK councils.,2026-03-12,2026-03-12
how-common-is-your-name,How Common Is Your Name?,fun,2,"Find out how popular your first name is in the UK. See ranking, peak decade and trend data from ONS baby name records spanning multiple decades.",2026-03-12,2026-03-12
slug-generator,Slug Generator,text,3,"Convert any title or text into a clean URL-friendly slug. Options for separator style, max length and accent transliteration. Copy to clipboard instantly.",2026-03-12,2026-03-12
word-frequency-counter,Word Frequency Counter,text,2,Analyse word frequency in any text. See a sorted table and visual chart of the most common words with options to filter common words and set minimum length.,2026-03-12,2026-03-12
fancy-text-generator,Fancy Text Generator,text,2,"Transform your text into 15+ Unicode styles including Bold, Italic, Script, Gothic, Small Caps, Circled, Bubble and more. Copy and paste anywhere.",2026-03-12,2026-03-12
instagram-caption-formatter,Instagram Caption Formatter,text,2,Format Instagram captions with line breaks that actually work. Uses invisible characters to preserve spacing. Includes character count and hashtag counter.,2026-03-12,2026-03-12
email-template-generator,Email Template Generator,text,2,"Generate professional emails from templates. Choose email type (complaint, request, thank you, follow-up and more) and tone for polished, ready-to-send copy.",2026-03-12,2026-03-12
jwt-decoder,JWT Decoder,developer,2,"Decode JWT tokens to see the header, payload and expiry status. Colour-coded sections with formatted JSON output. Paste any JWT to inspect its contents.",2026-03-12,2026-03-12
css-minifier,CSS Minifier,developer,2,"Minify CSS by removing comments, whitespace and unnecessary characters. See original and minified size with savings percentage. Copy or download the result.",2026-03-12,2026-03-12
javascript-minifier,JavaScript Minifier,developer,2,Minify JavaScript by removing comments and collapsing whitespace. See compression statistics with original and minified size comparison.,2026-03-12,2026-03-12
sql-formatter,SQL Formatter,developer,2,"Format messy SQL queries with proper indentation and keyword highlighting. Options for uppercase keywords and indent size. Supports SELECT, JOIN, WHERE and more.",2026-03-12,2026-03-12
html-entity-encoder,HTML Entity Encoder,developer,3,"Encode text to HTML entities or decode entities back to text. Handles named, numeric and hex entities. Bulk text support with instant copy to clipboard.",2026-03-12,2026-03-12
currency-converter,Currency Converter,travel,2,"Convert between 30+ major world currencies with approximate exchange rates. See converted amount, exchange rate and inverse rate for quick reference.",2026-03-12,2026-03-12
flight-time-calculator,Flight Time Calculator,travel,2,Calculate approximate flight times between major cities worldwide. Pre-built dataset of 100+ popular routes with distance in km and miles.,2026-03-12,2026-03-12
luggage-weight-checker,Luggage Weight Checker,travel,2,Check baggage allowances for 20+ airlines and pack against the limit. Add items from a pre-built weight database to track carry-on and checked bag weight.,2026-03-12,2026-03-12
jet-lag-calculator,Jet Lag Calculator,travel,2,"Calculate jet lag severity and recovery time for your trip. See timezone difference, recovery plan and direction-specific adjustment tips.",2026-03-12,2026-03-12
pace-to-finish-calculator,Pace to Finish Time Calculator,sports,3,"Calculate your predicted finish time for any running distance. Enter your pace per km or mile to see estimates for 5K, 10K, half marathon and marathon.",2026-03-12,2026-03-12
cycling-calorie-calculator,Cycling Calorie Calculator,sports,3,"Estimate calories burned cycling based on distance, speed, weight and terrain. Uses MET values for accurate calorie estimates across different riding conditions.",2026-03-12,2026-03-12
swim-pace-calculator,Swim Pace Calculator,sports,3,"Calculate your swimming pace per 100m from pool laps and time. See estimated times for 400m, 750m and 1500m distances with total distance swum.",2026-03-12,2026-03-12
ev-charging-time-calculator,EV Charging Time Calculator,automotive,2,"Calculate how long it takes to charge your electric vehicle. Choose from 10+ car presets and 5 charger types to see charge time, energy needed and estimated cost.",2026-03-12,2026-03-12
road-trip-cost-calculator,Road Trip Cost Calculator,automotive,2,"Calculate the fuel cost of any road trip. Enter distance, fuel type and efficiency to see total cost with optional passenger cost-splitting for group trips.",2026-03-12,2026-03-12
baby-name-explorer,Baby Name Explorer,parenting,2,"Browse and filter 500+ baby names by origin, gender, length and starting letter. Search by meaning or keyword to find the perfect name for your baby.",2026-03-12,2026-03-12
kg-to-ounces,Kg to Ounces Converter,converters,3,Convert kilograms to ounces instantly. Free kg to oz converter with common conversion reference table.,2026-03-13,2026-03-13
ounces-to-kg,Ounces to Kg Converter,converters,3,Convert ounces to kilograms easily. Free oz to kg converter with table of common conversions.,2026-03-13,2026-03-13
fl-oz-to-ml,Fl Oz to Ml Converter,converters,3,Convert fluid ounces to millilitres quickly. Free fl oz to ml converter for cooking and beverages.,2026-03-13,2026-03-13
ml-to-fl-oz,Ml to Fl Oz Converter,converters,3,Convert millilitres to fluid ounces easily. Free ml to fl oz converter for cooking recipes.,2026-03-13,2026-03-13
sticks-butter-to-grams,Sticks of Butter to Grams,converters,3,Convert butter sticks to grams for baking. Free converter for US butter measurements to metric grams.,2026-03-13,2026-03-13
gas-mark-to-celsius,Gas Mark to Celsius Converter,converters,3,Convert gas mark oven temperatures to Celsius. Free UK gas mark to celsius oven temperature converter.,2026-03-13,2026-03-13
knots-to-mph,Knots to Mph Converter,converters,3,Convert knots to miles per hour instantly. Free knots to mph converter for aviation and maritime.,2026-03-13,2026-03-13
mph-to-knots,Mph to Knots Converter,converters,3,Convert miles per hour to knots easily. Free mph to knots converter for ships and aircraft.,2026-03-13,2026-03-13
knots-to-kph,Knots to Kph Converter,converters,3,Convert knots to kilometres per hour instantly. Free knots to kph converter for maritime and aviation.,2026-03-13,2026-03-13
kph-to-knots,Kph to Knots Converter,converters,3,Convert kilometres per hour to knots easily. Free kph to knots converter for nautical and air travel.,2026-03-13,2026-03-13
nautical-miles-to-km,Nautical Miles to Km Converter,converters,3,Convert nautical miles to kilometres instantly. Free nautical miles to km converter for maritime navigation.,2026-03-13,2026-03-13
km-to-nautical-miles,Km to Nautical Miles Converter,converters,3,Convert kilometres to nautical miles easily. Free km to nautical miles converter for sea navigation.,2026-03-13,2026-03-13
fahrenheit-to-kelvin,Fahrenheit to Kelvin Converter,converters,3,Convert Fahrenheit to Kelvin instantly. Free F to K temperature converter for science and engineering.,2026-03-13,2026-03-13
kelvin-to-fahrenheit,Kelvin to Fahrenheit Converter,converters,3,Convert Kelvin to Fahrenheit easily. Free K to F temperature converter for scientific calculations.,2026-03-13,2026-03-13
hex-to-decimal,Hex to Decimal Converter,converters,3,Convert hexadecimal to decimal numbers instantly. Free hex to decimal converter for programming.,2026-03-13,2026-03-13
