slug,name,category,tier,description,date_added,last_tested
screen-time-calculator,Screen Time Calculator,parenting,2,Calculate recommended daily screen time for your child based on age and WHO/AAP guidelines. See how discretionary time is allocated and get tips for healthy habits.,2026-03-11,2026-03-11
grade-calculator,Grade Calculator,education,2,"Track your grades with weighted assignments. Calculate your current grade, see what you need on the final, and monitor progress towards your goal grade.",2026-03-11,2026-03-11
reading-level-checker,Reading Level Checker,education,2,"Analyze text readability using Flesch-Kincaid, Gunning Fog, and Coleman-Liau indices. Get a grade level and see if your writing matches your target audience.",2026-03-11,2026-03-11
flashcard-maker,Flashcard Maker,education,2,"Create and study flashcards online. Build your deck with question/answer pairs, shuffle for randomized study sessions, and track which cards you know.",2026-03-11,2026-03-11
packing-list-generator,Packing List Generator,travel,2,"Generate a customized packing checklist for your trip based on destination type, duration, and planned activities. Never forget an essential item again.",2026-03-11,2026-03-11
timezone-meeting-planner,Timezone Meeting Planner,travel,2,Find the best time to meet across multiple time zones. Visualize working hours overlap and see local times for all participants instantly.,2026-03-11,2026-03-11
travel-budget-calculator,Travel Budget Calculator,travel,2,"Plan your trip budget by destination and travel style. Get a detailed breakdown of costs for accommodation, food, activities, and transport.",2026-03-11,2026-03-11
business-profit-calculator,Business Profit Calculator,business,2,"Calculate profit margins, markup percentages, and break-even prices. Know exactly how much you're earning on each sale or what price you need to hit your profit target.",2026-03-11,2026-03-11
meeting-cost-calculator,Meeting Cost Calculator,business,2,See the real cost of meetings in real-time. Add attendees and hourly rates to understand how much each minute costs. Includes live timer for ongoing meetings.,2026-03-11,2026-03-11
email-subject-line-tester,Email Subject Line Tester,business,2,"Score your email subject lines on openability and deliverability. Get instant feedback on length, power words, spam triggers, and actionable improvements.",2026-03-11,2026-03-11
christmas-countdown,Christmas Countdown,seasonal,2,"Live countdown to Christmas with days, hours, minutes, and seconds. Shows year progress and fun festive facts.",2026-03-11,2026-03-11
halloween-costume-generator,Halloween Costume Generator,seasonal,2,"Generate random Halloween costume ideas by style (scary, funny, creative, group) and age group. Get material lists and budget breakdown.",2026-03-11,2026-03-11
new-year-resolution-generator,New Year Resolution Generator,seasonal,2,"Generate personalized New Year resolutions across health, career, relationships, finance, and hobbies. Track which ones you commit to.",2026-03-11,2026-03-11
fuel-cost-calculator,Fuel Cost Calculator,automotive,2,"Calculate fuel costs for a trip. Enter distance, fuel efficiency, and price per litre. Compare multiple vehicles side by side.",2026-03-11,2026-03-11
tyre-size-calculator,Tyre Size Calculator,automotive,2,"Calculate tyre dimensions (width, diameter, circumference) from tyre size. Compare two tyres and see speedometer impact.",2026-03-11,2026-03-11
car-loan-calculator,Car Loan Calculator,automotive,2,"Calculate car loan payments, total interest, and total cost. See monthly breakdown and amortization schedule for your vehicle purchase.",2026-03-11,2026-03-11
font-pair-suggester,Font Pair Suggester,creative,2,Select a heading font from 20 Google Fonts. Get recommended complementary body fonts with live preview and CSS import code.,2026-03-11,2026-03-11
wedding-budget-calculator,Wedding Budget Calculator,wedding,2,"Allocate your wedding budget across venue, catering, photography, and more. Adjust percentages and see real-time breakdown.",2026-03-11,2026-03-11
wedding-countdown,Wedding Countdown,wedding,2,"Countdown to your wedding day with days, hours, minutes, and seconds. Includes planning milestones and checklist for each stage.",2026-03-11,2026-03-11
custom-countdown,Custom Countdown Timer,datetime,2,"Create a beautiful countdown to any date and time. Set an event name, target date, and watch the live countdown. Shows weeks, days, hours, minutes, and seconds.",2026-03-11,2026-03-11
new-year-countdown,New Year Countdown,seasonal,2,"Countdown to January 1st with a beautiful New Year themed display. Features year progress bar, fun facts about the year, and global New Year traditions.",2026-03-11,2026-03-11
birthday-countdown,Birthday Countdown,datetime,2,"Track the countdown to your next birthday. Shows your current age, zodiac sign, days lived, and fun birthday facts. Enter your birth month and day to get started.",2026-03-11,2026-03-11
retirement-countdown,Retirement Countdown,finance,2,"Calculate your countdown to retirement. Enter your date of birth and planned retirement age (or specific date). Shows working days remaining, career progress, and freedom stats.",2026-03-11,2026-03-11
baby-due-date-countdown,Baby Due Date Countdown,parenting,1,"Track your pregnancy journey with live countdown to baby's arrival. Shows weeks and days pregnant, current trimester, baby size comparison, and development milestones.",2026-03-11,2026-03-11
holiday-countdown,Holiday Countdown,travel,2,"Count down to your holiday with departure date and destination. Get packing reminder milestones, work days remaining, and a pre-trip checklist to stay organized.",2026-03-11,2026-03-11
qr-code-generator,QR Code Generator,developer,2,"Generate QR codes for website URLs and plain text. Download as PNG or SVG with custom colours. Free, instant, no sign-up required.",2026-03-11,2026-03-11
recipe-scaler,Recipe Scaler,cooking,2,"Scale any recipe up or down. Enter your ingredients, adjust servings, and get perfectly recalculated quantities. Quick buttons for doubling and halving.",2026-03-11,2026-03-11
cooking-time-calculator,Cooking Time Calculator,cooking,2,"Calculate roasting times for chicken, turkey, beef, lamb, pork and more. Enter the weight, select doneness, and get oven temperature, cooking time, resting time and a full timeline.",2026-03-11,2026-03-11
baking-substitution-finder,Baking Substitution Finder,cooking,2,"Find baking substitutions for eggs, butter, milk, sugar, flour and more. Filter by vegan, dairy-free, and gluten-free options with exact ratios and baking tips.",2026-03-11,2026-03-11
cake-tin-converter,Cake Tin Converter,cooking,2,"Convert cake recipes between different tin sizes and shapes. Round to square, 8 inch to 10 inch — get the exact ingredient multiplier and adjusted baking times.",2026-03-11,2026-03-11
coffee-ratio-calculator,Coffee Ratio Calculator,cooking,2,"Get the perfect coffee-to-water ratio for any brewing method. French press, pour over, espresso, cold brew and more. Adjust strength and units to your preference.",2026-03-11,2026-03-11
cups-to-grams-flour,Cups to Grams — Flour,cooking,3,"Convert cups of flour to grams and back. Quick reference table for plain, self-raising, bread, wholemeal, almond and coconut flour with accurate weights per cup.",2026-03-11,2026-03-11
cups-to-grams-sugar,Cups to Grams — Sugar,cooking,3,"Convert cups of sugar to grams and back. Covers granulated, caster, brown, icing and demerara sugar with accurate weights per cup.",2026-03-11,2026-03-11
cups-to-grams-butter,Cups to Grams — Butter,cooking,3,"Convert cups and sticks of butter to grams and back. Includes conversions for margarine, coconut oil, and other fats with exact weights.",2026-03-11,2026-03-11
cups-to-grams-rice,Cups to Grams — Rice,cooking,3,"Convert cups of rice to grams for perfect portions. Covers basmati, brown, arborio, sushi and wild rice with accurate weights per cup.",2026-03-11,2026-03-11
cups-to-grams-oats,Cups to Grams — Oats,cooking,3,"Convert cups of oats to grams and back. Covers rolled oats, quick oats, steel-cut oats and oat flour with accurate weights per cup.",2026-03-11,2026-03-11
paint-calculator,Paint Calculator,home,2,"Calculate how much paint you need for any room. Enter dimensions, deduct doors and windows, choose paint type and number of coats. Get tin sizes and cost estimates.",2026-03-11,2026-03-11
tile-calculator,Tile Calculator,home,2,"Calculate how many tiles, adhesive and grout you need. Enter your area, tile size, and laying pattern. Includes wastage allowance and cost estimates.",2026-03-11,2026-03-11
wallpaper-calculator,Wallpaper Calculator,home,2,"Calculate how many rolls of wallpaper you need. Accounts for pattern repeat, doors, windows, and different roll sizes. Never over-buy or under-buy again.",2026-03-11,2026-03-11
fence-calculator,Fence Calculator,home,2,"Calculate fence panels, posts, concrete and materials for your garden fence. Choose height, panel width, and add gates. Get a full shopping list with cost estimates.",2026-03-11,2026-03-11
gravel-calculator,Gravel Calculator,home,2,"Calculate how much gravel, aggregate or sand you need in tonnes and bags. Enter your area and depth, select material type, and get accurate quantities with cost estimates.",2026-03-11,2026-03-11
concrete-calculator,Concrete Calculator,home,2,"Calculate concrete volume, cement bags and mix ratios for slabs, circular pads and post holes. Get quantities for premix bags or DIY mixing with cost estimates.",2026-03-11,2026-03-11
uk-lotto-number-picker,UK Lotto Number Picker,games,2,"Generate random UK National Lottery numbers. Pick 6 numbers from 1-59 with animated ball reveals, quick pick 5 lines at once, and track your pick history.",2026-03-11,2026-03-11
euromillions-number-picker,EuroMillions Number Picker,games,2,Generate random EuroMillions numbers. Pick 5 main numbers (1-50) plus 2 Lucky Stars (1-12) with animated reveals and multi-line quick picks.,2026-03-11,2026-03-11
thunderball-number-picker,Thunderball Number Picker,games,2,Generate random Thunderball numbers. Pick 5 main numbers (1-39) plus 1 Thunderball (1-14) with animated ball reveals and quick pick options.,2026-03-11,2026-03-11
set-for-life-number-picker,Set for Life Number Picker,games,2,Generate random Set for Life numbers. Pick 5 main numbers (1-47) plus 1 Life Ball (1-10) with animated reveals and multi-line quick picks.,2026-03-11,2026-03-11
powerball-number-picker,Powerball Number Picker,games,2,Generate random US Powerball numbers. Pick 5 main numbers (1-69) plus 1 Powerball (1-26) with animated ball reveals and quick pick options.,2026-03-11,2026-03-11
mega-millions-number-picker,Mega Millions Number Picker,games,2,Generate random US Mega Millions numbers. Pick 5 main numbers (1-70) plus 1 Mega Ball (1-25) with animated reveals and multi-line quick picks.,2026-03-11,2026-03-11
big-five-personality-test,Big Five Personality Test,quiz,1,"Discover your personality across Openness, Conscientiousness, Extraversion, Agreeableness, and Neuroticism. 50 research-backed questions with radar chart results and a shareable personality card.",2026-03-11,2026-03-11
attachment-style-quiz,Attachment Style Quiz,quiz,2,"Discover your attachment style — Secure, Anxious, Avoidant, or Fearful-Avoidant. 20 questions based on Bowlby & Ainsworth's attachment theory with shareable results card.",2026-03-11,2026-03-11
love-language-quiz,Love Language Quiz,quiz,2,"Find your primary love language — Words of Affirmation, Acts of Service, Receiving Gifts, Quality Time, or Physical Touch. 25 questions with partner communication tips.",2026-03-11,2026-03-11
self-esteem-scale,Self-Esteem Assessment,quiz,2,Measure your self-esteem with the Rosenberg Self-Esteem Scale — the world's most widely used self-esteem measure. 10 questions with score interpretation and downloadable results.,2026-03-11,2026-03-11
depression-screening-phq9,Depression Screening (PHQ-9),quiz,2,"Quick, clinically validated depression screening based on the PHQ-9. 9 questions used by GPs worldwide. Includes score interpretation and mental health support resources.",2026-03-11,2026-03-11
anxiety-screening-gad7,Anxiety Screening (GAD-7),quiz,2,Clinically validated anxiety screening based on the GAD-7. 7 questions used by healthcare professionals worldwide. Includes score interpretation and support resources.,2026-03-11,2026-03-11
narcissism-test,Narcissism Test (NPI-16),quiz,2,Measure narcissistic personality traits with the NPI-16 — a research-validated short assessment. 16 forced-choice questions with comparison to population average.,2026-03-11,2026-03-11
emotional-intelligence-quiz,Emotional Intelligence Quiz,quiz,2,"Assess your emotional intelligence across 4 domains — Perceiving, Using, Understanding, and Managing emotions. 20 real-world scenarios with EQ score and growth tips.",2026-03-11,2026-03-11
crush-quiz,Does My Crush Like Me?,quiz,2,Find out if your crush might have feelings for you! 15 fun questions about their behaviour — from texting habits to body language. Shareable results card included.,2026-03-11,2026-03-11
red-flags-quiz,Is My Partner Toxic? (Red Flags Quiz),quiz,2,"Are you investigating if your relationship is toxic? Take our free red flags test. Answer 20 questions to identify warning signs, control, or manipulation from a partner.",2026-03-11,2026-03-11
communication-style-quiz,Communication Style Quiz,quiz,2,"Discover your communication style — Passive, Aggressive, Passive-Aggressive, or Assertive. 16 real-world scenarios with tips for more effective communication.",2026-03-11,2026-03-11
betting-odds-calculator,Betting Odds Calculator,sports,2,"Calculate potential returns for single bets, accumulators, and each-way bets. Convert between fractional, decimal, and American odds. Essential tool for UK punters.",2026-03-11,2026-03-11
darts-score-tracker,Darts Score Tracker,sports,1,"Live darts scoreboard for 501, 301, and 701. 2-4 players with quick score buttons, checkout suggestions, bust detection, and full match statistics.",2026-03-11,2026-03-11
tournament-bracket-generator,Tournament Bracket Generator,sports,1,"Create tournament brackets and fixtures for any competition. Single elimination, double elimination, or round robin. Enter team names, randomise seedings, track results.",2026-03-11,2026-03-11
running-training-plan,Running Training Plan Generator,sports,1,"Generate a personalised running training plan for 5K, 10K, half marathon or marathon. Choose your level, training weeks, and get a printable week-by-week schedule.",2026-03-11,2026-03-11
golf-handicap-calculator,Golf Handicap Calculator,sports,2,"Calculate your golf handicap using the World Handicap System (WHS). Enter rounds, get your Handicap Index, and calculate Course Handicap for any course.",2026-03-11,2026-03-11
macro-calculator,Macro Calculator,health,1,"Calculate your daily protein, carbs, and fat targets for any diet — keto, high protein, Mediterranean, vegan, paleo, and more. Includes per-meal breakdown and downloadable macro card.",2026-03-11,2026-03-11
invoice-generator,Invoice Generator,business,1,"Create professional invoices for free. Add your business details, line items, tax, discounts, and download a clean invoice image — no account needed.",2026-03-11,2026-03-11
colour-palette-generator,Colour Palette Generator,creative,1,"Generate beautiful colour palettes instantly. Choose from random, monochromatic, analogous, complementary, triadic, pastel, and more. Lock colours, copy hex codes, download as PNG.",2026-03-11,2026-03-11
pomodoro-timer,Pomodoro Timer,datetime,1,"Free online Pomodoro timer with customisable work and break durations. Track focus sessions, see daily stats, and boost your productivity with the Pomodoro Technique.",2026-03-11,2026-03-11
sudoku-generator,Sudoku Generator,games,1,"Generate and play Sudoku puzzles online. Four difficulty levels from easy to expert, with pencil notes, hints, timer, and downloadable printable puzzles.",2026-03-11,2026-03-11
mortgage-affordability-calculator,Mortgage Affordability Calculator,finance,1,"Find out how much mortgage you could borrow based on your salary, outgoings, and deposit. Uses UK affordability rules with salary multiplier comparison table.",2026-03-11,2026-03-11
unit-price-calculator,Unit Price Calculator,home,2,"Compare supermarket prices per unit to find the best deal. Add up to 6 products with different sizes and units — instantly see price per 100g, per litre, and which is best value.",2026-03-11,2026-03-11
aspect-ratio-calculator,Aspect Ratio Calculator,creative,2,"Calculate and convert aspect ratios for images and video. Lock ratios, use platform presets for Instagram, YouTube, TikTok, and more. Shows megapixels and orientation.",2026-03-11,2026-03-11
baby-growth-calculator,Baby Growth Percentile Calculator,parenting,1,"Plot your baby on WHO growth charts. Enter age, weight, and length to see their percentile for 0-24 months — with visual growth chart and friendly explanations.",2026-03-11,2026-03-11
readability-checker,Readability Score Checker,text,2,"Check how easy your text is to read. Get Flesch Reading Ease, Flesch-Kincaid Grade Level, Gunning Fog, SMOG, and Coleman-Liau scores with improvement suggestions.",2026-03-11,2026-03-11
word-search-generator,Word Search Generator,education,1,"Create custom word search puzzles online. Choose your own words or pick a theme, set grid size and difficulty, play interactively, and download printable puzzles.",2026-03-12,2026-03-12
christmas-word-search,Christmas Word Search,education,2,"Free printable Christmas word search puzzle with festive words like reindeer, stocking, tinsel, and mistletoe. Play online or download and print.",2026-03-12,2026-03-12
halloween-word-search,Halloween Word Search,education,2,"Free printable Halloween word search with spooky words like vampire, skeleton, cauldron, and broomstick. Play online or download and print.",2026-03-12,2026-03-12
animals-word-search,Animals Word Search,education,2,"Free printable animals word search puzzle featuring elephant, giraffe, penguin, dolphin, and more. Perfect for classrooms and kids. Play online or print.",2026-03-12,2026-03-12
word-scramble-generator,Word Scramble Generator,education,2,Create word scramble worksheets from your own words or preset themes. Three difficulty levels. Download printable worksheets with answer keys.,2026-03-12,2026-03-12
handwriting-practice-sheet,Handwriting Practice Sheet Generator,education,2,"Generate custom handwriting practice sheets with traced letters and blank lines. Choose print or cursive, adjust spacing and size. Download printable worksheets.",2026-03-12,2026-03-12
spelling-test-generator,Spelling Test Generator,education,2,"Create spelling test sheets from your word list. Generates shuffled tests with numbered blanks, optional sentence lines, and answer keys. Download printable tests.",2026-03-12,2026-03-12
times-tables-practice,Times Tables Practice,education,2,"Interactive times tables drill with instant feedback and score tracking. Pick your tables, race the clock, and print practice worksheets. Perfect for kids and classrooms.",2026-03-12,2026-03-12
maths-worksheet-generator,Maths Worksheet Generator,education,2,"Generate printable maths worksheets with addition, subtraction, multiplication, and division. Set difficulty, number range, and question count. Includes answer keys.",2026-03-12,2026-03-12
citation-generator,Citation Generator,education,2,"Generate citations in APA, MLA, Harvard, Chicago, and Vancouver formats. Supports books, websites, journals, newspapers, and videos. Build full bibliographies.",2026-03-12,2026-03-12
uk-dividend-tax-calculator,UK Dividend Tax Calculator,finance,2,"Calculate tax on your UK dividend income for 2026/27. Shows the £500 dividend allowance, basic (8.75%), higher (33.75%) and additional (39.35%) rates with a full breakdown.",2026-03-12,2026-03-12
uk-capital-gains-tax-calculator,UK Capital Gains Tax Calculator,finance,2,"Calculate CGT on shares, property or business assets for 2026/27. Includes the £3,000 annual exempt amount, Business Assets Relief, and residential property rates.",2026-03-12,2026-03-12
uk-inheritance-tax-calculator,UK Inheritance Tax Calculator,finance,2,"Estimate your UK inheritance tax bill. Includes nil-rate band (£325k), residence nil-rate band (£175k), spouse exemption, charity rate, and taper relief for large estates.",2026-03-12,2026-03-12
uk-student-loan-calculator,UK Student Loan Repayment Calculator,finance,2,"Calculate your monthly student loan repayment and see how long until it is paid off. Supports Plan 1, 2, 4, 5 and Postgraduate loans with projected timelines.",2026-03-12,2026-03-12
uk-pension-calculator,UK Pension Calculator,finance,2,"Project your pension pot at retirement. Enter your salary, contributions and growth rate to see a year-by-year forecast, tax relief breakdown and estimated retirement income.",2026-03-12,2026-03-12
uk-salary-sacrifice-calculator,UK Salary Sacrifice Calculator,finance,2,"See how much you save with salary sacrifice. Compare take-home pay before and after sacrificing for pension, cycle to work, childcare vouchers or EV lease.",2026-03-12,2026-03-12
uk-self-assessment-estimator,UK Self-Assessment Tax Estimator,finance,2,"Estimate your self-assessment tax bill for 2026/27. Enter employment, self-employment, rental, dividend and other income to see your total tax, NI and payments on account.",2026-03-12,2026-03-12
uk-buy-to-let-calculator,UK Buy-to-Let Calculator,finance,2,"Calculate rental yield, cash flow and profit for a UK buy-to-let investment. Includes SDLT surcharge, Section 24 mortgage interest rules, and tax at your marginal rate.",2026-03-12,2026-03-12
mm-to-inches,MM to Inches Converter,converters,3,Convert millimetres to inches instantly. Free online mm to inch calculator with common conversion table and formula.,2026-03-12,2026-03-12
inches-to-mm,Inches to MM Converter,converters,3,Convert inches to millimetres quickly. Free online inch to mm calculator with common conversions and formula.,2026-03-12,2026-03-12
metres-to-yards,Metres to Yards Converter,converters,3,Convert metres to yards instantly. Free online metre to yard calculator with common values and conversion formula.,2026-03-12,2026-03-12
yards-to-metres,Yards to Metres Converter,converters,3,Convert yards to metres quickly. Free online yard to metre calculator with common conversions and formula.,2026-03-12,2026-03-12
mm-to-cm,MM to CM Converter,converters,3,Convert millimetres to centimetres instantly. Free online mm to cm calculator with common values and formula.,2026-03-12,2026-03-12
cm-to-mm,CM to MM Converter,converters,3,Convert centimetres to millimetres quickly. Free online cm to mm calculator with common conversions and formula.,2026-03-12,2026-03-12
metres-to-km,Metres to Kilometres Converter,converters,3,Convert metres to kilometres instantly. Free online m to km calculator with common values and conversion formula.,2026-03-12,2026-03-12
km-to-metres,Kilometres to Metres Converter,converters,3,Convert kilometres to metres quickly. Free online km to m calculator with common conversions and formula.,2026-03-12,2026-03-12
feet-to-inches,Feet to Inches Converter,converters,3,Convert feet to inches instantly. Free online feet to inches calculator with common values and conversion formula.,2026-03-12,2026-03-12
inches-to-feet,Inches to Feet Converter,converters,3,Convert inches to feet and inches. Free online inch to feet calculator with display in feet and inches format.,2026-03-12,2026-03-12
oz-to-ml,Fluid Ounces to ML Converter,converters,3,Convert fluid ounces to millilitres instantly. Free online fl oz to ml calculator with common values and formula.,2026-03-12,2026-03-12
ml-to-oz,ML to Fluid Ounces Converter,converters,3,Convert millilitres to fluid ounces quickly. Free online ml to fl oz calculator with common conversions and formula.,2026-03-12,2026-03-12
grams-to-kg,Grams to Kilograms Converter,converters,3,Convert grams to kilograms instantly. Free online g to kg calculator with common conversion values and formula.,2026-03-12,2026-03-12
kg-to-grams,Kilograms to Grams Converter,converters,3,Convert kilograms to grams quickly. Free online kg to g calculator with common conversions and formula.,2026-03-12,2026-03-12
miles-to-metres,Miles to Metres Converter,converters,3,Convert miles to metres instantly. Free online mile to metre calculator with common values and conversion formula.,2026-03-12,2026-03-12
metres-to-miles,Metres to Miles Converter,converters,3,Convert metres to miles quickly. Free online metre to mile calculator with common conversions and formula.,2026-03-12,2026-03-12
celsius-to-kelvin,Celsius to Kelvin Converter,converters,3,Convert Celsius to Kelvin instantly. Free online temperature converter with common values and the conversion formula.,2026-03-12,2026-03-12
kelvin-to-celsius,Kelvin to Celsius Converter,converters,3,Convert Kelvin to Celsius quickly. Free online temperature converter with common conversions and formula.,2026-03-12,2026-03-12
cups-to-tbsp,Cups to Tablespoons Converter,converters,3,Convert cups to tablespoons instantly. Free online cups to tbsp calculator for cooking and baking recipes.,2026-03-12,2026-03-12
tbsp-to-cups,Tablespoons to Cups Converter,converters,3,Convert tablespoons to cups quickly. Free online tbsp to cups calculator for cooking and baking measurements.,2026-03-12,2026-03-12
tbsp-to-tsp,Tablespoons to Teaspoons Converter,converters,3,Convert tablespoons to teaspoons instantly. Free online tbsp to tsp calculator for precise recipe measurements.,2026-03-12,2026-03-12
